variable,type,label_de,study,dataset,version,meantable,probtable,template_id,label,concept,description,description_de,minedition,topic,rawdata,documentation_link,documentation_link_html,documentation_paper,documentation_paper_html
ple0128_h,float,Contribution for private supplementary health insurance,soep-core,p_data,v36,Yes,No,,,,"The variable describes the monthly amount for private health insurance. (What do you pay for that per month?) For 2010-2013, 2016, 2018, question not asked for all samples.",,,Health and Care,pl,https://paneldata.org/soep-core/data/pl/ple0128_h,`ple0128_h <https://paneldata.org/soep-core/data/pl/ple0128_h>`_,,
ple0160,byte,Change of insurance company in previous year,soep-core,p_data,v36,No,Yes,,,,"The variable describes whether the respondent has changed health insurance in the last year. . For 2010-2013, 2015-2019, question not asked for all samples.",,,Health and Care,pl,https://paneldata.org/soep-core/data/pl/ple0160,`ple0160 <https://paneldata.org/soep-core/data/pl/ple0160>`_,,
ple0162,byte,Health problems longer than half a year,soep-core,p_data,v36,No,Yes,,,,"The variable describes whether the respondent has had health problems for more than 6 months. (Have you had this impairment for longer than six months?) For 2016-2018, question not asked for all samples",,,Health and Care,pl,https://paneldata.org/soep-core/data/pl/ple0162,`ple0162 <https://paneldata.org/soep-core/data/pl/ple0162>`_,,
plh0032,byte,Worries: Economic development,soep-core,p_data,v36,No,Yes,,,,"For 2013, 2015-2019, question not asked for all samples",,,"Attitudes, Values, and Personality",pl,https://paneldata.org/soep-core/data/pl/plh0032,`plh0032 <https://paneldata.org/soep-core/data/pl/plh0032>`_,,
plh0033,byte,Worries: Finances,soep-core,p_data,v36,No,Yes,,,,The collection of variables describes what concerns the respondent has (How concerned are you about the following issues?).  ,,,"Attitudes, Values, and Personality",pl,https://paneldata.org/soep-core/data/pl/plh0033,`plh0033 <https://paneldata.org/soep-core/data/pl/plh0033>`_,,
plh0034,byte,Worries: Stability of financial markets,soep-core,p_data,v36,No,Yes,,,,The collection of variables describes what concerns the respondent has (How concerned are you about the following issues?). Question not asked for all samples.,,,"Attitudes, Values, and Personality",pl,https://paneldata.org/soep-core/data/pl/plh0034,`plh0034 <https://paneldata.org/soep-core/data/pl/plh0034>`_,,
plh0035,byte,Worries: Own health,soep-core,p_data,v36,No,Yes,,,,"The collection of variables describes what concerns the respondent has (How concerned are you about the following issues?). For 2011-2013, question not asked for all samples.",,,"Attitudes, Values, and Personality",pl,https://paneldata.org/soep-core/data/pl/plh0035,`plh0035 <https://paneldata.org/soep-core/data/pl/plh0035>`_,,
plh0036,byte,Worries: Environment,soep-core,p_data,v36,No,Yes,,,,"The collection of variables describes what concerns the respondent has (How concerned are you about the following issues?). For 2011-2013, 2015-2019, question not asked for all samples.",,,"Attitudes, Values, and Personality",pl,https://paneldata.org/soep-core/data/pl/plh0036,`plh0036 <https://paneldata.org/soep-core/data/pl/plh0036>`_,,
plh0037,byte,Worries: Consequences from climate change,soep-core,p_data,v36,No,Yes,,,,"The collection of variables describes what concerns the respondent has (How concerned are you about the following issues?). For 2011-2013, 2015-2019, question not asked for all samples.",,,"Attitudes, Values, and Personality",pl,https://paneldata.org/soep-core/data/pl/plh0037,`plh0037 <https://paneldata.org/soep-core/data/pl/plh0037>`_,,
plh0038,byte,Worries: Peace,soep-core,p_data,v36,No,Yes,,,,"The collection of variables describes what concerns the respondent has. (How concerned are you about the following issues?) For 2011-2013, 2015-2019, question not asked for all samples.",,,"Attitudes, Values, and Personality",pl,https://paneldata.org/soep-core/data/pl/plh0038,`plh0038 <https://paneldata.org/soep-core/data/pl/plh0038>`_,,
plh0039,byte,Worries: Global terrorism,soep-core,p_data,v36,No,Yes,,,,"The collection of variables describes what concerns the respondent has. (How concerned are you about the following issues?) For 2010-2013, 2018, question not asked for all samples.",,,"Attitudes, Values, and Personality",pl,https://paneldata.org/soep-core/data/pl/plh0039,`plh0039 <https://paneldata.org/soep-core/data/pl/plh0039>`_,,
plh0040,byte,Worries: Crime in Germany,soep-core,p_data,v36,No,Yes,,,,"The collection of variables describes what concerns the respondent has. (How concerned are you about the following issues?) For 2011-2013, 2015-2019, question not asked for all samples.",,,"Attitudes, Values, and Personality",pl,https://paneldata.org/soep-core/data/pl/plh0040,`plh0040 <https://paneldata.org/soep-core/data/pl/plh0040>`_,,
plh0042,byte,Worries: Job Security,soep-core,p_data,v36,No,Yes,,,,"The collection of variables describes what concerns the respondent has (How concerned are you about the following issues?). For 2012, questionnaire version with changed filter management. For 2016-2019, question not asked for all samples.",,,"Attitudes, Values, and Personality",pl,https://paneldata.org/soep-core/data/pl/plh0042,`plh0042 <https://paneldata.org/soep-core/data/pl/plh0042>`_,,
plh0105,byte,Importance: To be there for others,soep-core,p_data,v36,No,Yes,,,,"The collection of variables describes how important certain things are to the respondent. (Different things are important to different people, How important are the following things to you? Very important, important, less important or quite unimportant?) For 1990, 2010, 2016, question not asked for all samples.",,,"Attitudes, Values, and Personality",pl,https://paneldata.org/soep-core/data/pl/plh0105,`plh0105 <https://paneldata.org/soep-core/data/pl/plh0105>`_,,
plh0106,byte,Importance: to realize oneself,soep-core,p_data,v36,No,Yes,,,,"The collection of variables describes how important certain things are to the respondent. (Different things are important to different people, How important are the following things to you? Very important, important, less important or quite unimportant?) For 1990, 2010, 2016, question not asked for all samples.",,,"Attitudes, Values, and Personality",pl,https://paneldata.org/soep-core/data/pl/plh0106,`plh0106 <https://paneldata.org/soep-core/data/pl/plh0106>`_,,
plh0107,byte,Importance: To be successful in business,soep-core,p_data,v36,No,Yes,,,,"The collection of variables describes how important certain things are to the respondent. (Different things are important to different people, How important are the following things to you? Very important, important, less important or quite unimportant?) For 1990, 2010, 2016, question not asked for all samples.",,,"Attitudes, Values, and Personality",pl,https://paneldata.org/soep-core/data/pl/plh0107,`plh0107 <https://paneldata.org/soep-core/data/pl/plh0107>`_,,
plh0108,byte,Importance: To have own house,soep-core,p_data,v36,No,Yes,,,,"The collection of variables describes how important certain things are to the respondent. (Different things are important to different people, How important are the following things to you? Very important, important, less important or quite unimportant?) For 1990, 2010, 2016, question not asked for all samples.",,,"Attitudes, Values, and Personality",pl,https://paneldata.org/soep-core/data/pl/plh0108,`plh0108 <https://paneldata.org/soep-core/data/pl/plh0108>`_,,
plh0109,byte,"Importance: To have a happy marriage, partnership",soep-core,p_data,v36,No,Yes,,,,"The collection of variables describes how important certain things are to the respondent. (Different things are important to different people, How important are the following things to you? Very important, important, less important or quite unimportant?) For 1990, 2010, 2016, question not asked for all samples.",,,"Attitudes, Values, and Personality",pl,https://paneldata.org/soep-core/data/pl/plh0109,`plh0109 <https://paneldata.org/soep-core/data/pl/plh0109>`_,,
plh0110,byte,Importance: To have children,soep-core,p_data,v36,No,Yes,,,,"The collection of variables describes how important certain things are to the respondent. (Different things are important to different people, How important are the following things to you? Very important, important, less important or quite unimportant?) For 1990, 2010, 2016, question not asked for all samples.",,,"Attitudes, Values, and Personality",pl,https://paneldata.org/soep-core/data/pl/plh0110,`plh0110 <https://paneldata.org/soep-core/data/pl/plh0110>`_,,
plh0111,byte,"Importance: To be politically, socially active",soep-core,p_data,v36,No,Yes,,,,"The collection of variables describes how important certain things are to the respondent. (Different things are important to different people, How important are the following things to you? Very important, important, less important or quite unimportant?) For 1990, 2010, 2016, question not asked for all samples.",,,"Attitudes, Values, and Personality",pl,https://paneldata.org/soep-core/data/pl/plh0111,`plh0111 <https://paneldata.org/soep-core/data/pl/plh0111>`_,,
plh0112,byte,"Importance: See the world, travel a lot",soep-core,p_data,v36,No,Yes,,,,"The collection of variables describes how important certain things are to the respondent. (Different things are important to different people, How important are the following things to you? Very important, important, less important or quite unimportant?) For 1990, 2010, 2016, question not asked for all samples.",,,"Attitudes, Values, and Personality",pl,https://paneldata.org/soep-core/data/pl/plh0112,`plh0112 <https://paneldata.org/soep-core/data/pl/plh0112>`_,,
plh0162,byte,Satisfaction: Standard of Living,soep-core,p_data,v36,Yes,Yes,,,,"The collection of variables describes how satisfied the respondent is with certain things. (How satisfied are you today with the following areas of your life?) For 1990, 2013, 2018, question not asked for all samples.",,,"Attitudes, Values, and Personality",pl,https://paneldata.org/soep-core/data/pl/plh0162,`plh0162 <https://paneldata.org/soep-core/data/pl/plh0162>`_,,
plh0164,byte,Satisfaction: School Education and Vocational Retraining,soep-core,p_data,v36,Yes,Yes,,,,"The collection of variables describes how satisfied the respondent is with certain things. (How satisfied are you today with the following areas of your life?) For 2019, question not asked for all samples.",,,"Attitudes, Values, and Personality",pl,https://paneldata.org/soep-core/data/pl/plh0164,`plh0164 <https://paneldata.org/soep-core/data/pl/plh0164>`_,,
plh0171,byte,Satisfaction: Health,soep-core,p_data,v36,Yes,Yes,,,,"The collection of variables describes how satisfied the respondent is with certain things. (How satisfied are you today with the following areas of your life?) For 2011-2012, 2015-2018, question not asked for all samples.",,,"Attitudes, Values, and Personality",pl,https://paneldata.org/soep-core/data/pl/plh0171,`plh0171 <https://paneldata.org/soep-core/data/pl/plh0171>`_,,
plh0172,byte,Satisfaction: Sleep,soep-core,p_data,v36,Yes,Yes,,,,"The collection of variables describes how satisfied the respondent is with certain things. (How satisfied are you today with the following areas of your life?) For 2011-2013, 2015-2019, question not asked for all samples.",,,"Attitudes, Values, and Personality",pl,https://paneldata.org/soep-core/data/pl/plh0172,`plh0172 <https://paneldata.org/soep-core/data/pl/plh0172>`_,,
plh0173,byte,Satisfaction: Work,soep-core,p_data,v36,Yes,Yes,,,,"The collection of variables describes how satisfied the respondent is with certain things. (How satisfied are you today with the following areas of your life?) For 2011-2013, 2015-2019, question not asked for all samples.",,,"Attitudes, Values, and Personality",pl,https://paneldata.org/soep-core/data/pl/plh0173,`plh0173 <https://paneldata.org/soep-core/data/pl/plh0173>`_,,
plh0174,byte,Satisfaction: Housework,soep-core,p_data,v36,Yes,Yes,,,,"The collection of variables describes how satisfied the respondent is with certain things. (How satisfied are you today with the following areas of your life?) For 1990, 2011-2013, 2015-2019, question not asked for all samples.",,,"Attitudes, Values, and Personality",pl,https://paneldata.org/soep-core/data/pl/plh0174,`plh0174 <https://paneldata.org/soep-core/data/pl/plh0174>`_,,
plh0175,byte,Satisfaction: Household Income,soep-core,p_data,v36,Yes,Yes,,,,"The collection of variables describes how satisfied the respondent is with certain things. (How satisfied are you today with the following areas of your life?) For 2011-2012, 2015-2019, question not asked for all samples.",,,"Attitudes, Values, and Personality",pl,https://paneldata.org/soep-core/data/pl/plh0175,`plh0175 <https://paneldata.org/soep-core/data/pl/plh0175>`_,,
plh0176,byte,Satisfaction: Personal Income,soep-core,p_data,v36,Yes,Yes,,,,"The collection of variables describes how satisfied the respondent is with certain things. (How satisfied are you today with the following areas of your life?) For 2011-2013, question not asked for all samples.",,,"Attitudes, Values, and Personality",pl,https://paneldata.org/soep-core/data/pl/plh0176,`plh0176 <https://paneldata.org/soep-core/data/pl/plh0176>`_,,
plh0177,byte,Satisfaction: Dwelling,soep-core,p_data,v36,Yes,Yes,,,,"The collection of variables describes how satisfied the respondent is with certain things. (How satisfied are you today with the following areas of your life?) For 2011-2012, 2015-2019, question not asked for all samples.",,,"Attitudes, Values, and Personality",pl,https://paneldata.org/soep-core/data/pl/plh0177,`plh0177 <https://paneldata.org/soep-core/data/pl/plh0177>`_,,
plh0178,byte,Satisfaction: Amount Of Leisure Time,soep-core,p_data,v36,Yes,Yes,,,,"The collection of variables describes how satisfied the respondent is with certain things. (How satisfied are you today with the following areas of your life?) For 2011-2013, 2015-2019, question not asked for all samples.",,,"Attitudes, Values, and Personality",pl,https://paneldata.org/soep-core/data/pl/plh0178,`plh0178 <https://paneldata.org/soep-core/data/pl/plh0178>`_,,
plh0179,byte,Satisfaction: Child Care,soep-core,p_data,v36,Yes,Yes,,,,"The collection of variables describes how satisfied the respondent is with certain things. (How satisfied are you today with the following areas of your life?) For 1990, 2011-2013, 2015-2019, question not asked for all samples.",,,"Attitudes, Values, and Personality",pl,https://paneldata.org/soep-core/data/pl/plh0179,`plh0179 <https://paneldata.org/soep-core/data/pl/plh0179>`_,,
plh0180,byte,Satisfaction: Family Life,soep-core,p_data,v36,Yes,Yes,,,,"The collection of variables describes how satisfied the respondent is with certain things. (How satisfied are you today with the following areas of your life?) For 2011-2013, 2015-2019, question not asked for all samples.",,,"Attitudes, Values, and Personality",pl,https://paneldata.org/soep-core/data/pl/plh0180,`plh0180 <https://paneldata.org/soep-core/data/pl/plh0180>`_,,
plh0182,byte,Satisfaction: Current Life,soep-core,p_data,v36,Yes,Yes,,,,"The variable describes how satisfied the respondent is with life overall. (In conclusion, we would like to ask you about your satisfaction with your life in general. How satisfied are you with your life, all things considered?) For 2011-2012, question not asked for all samples.",,,"Attitudes, Values, and Personality",pl,https://paneldata.org/soep-core/data/pl/plh0182,`plh0182 <https://paneldata.org/soep-core/data/pl/plh0182>`_,,
plh0183,byte,Satisfaction: Life in Five Years,soep-core,p_data,v36,Yes,Yes,,,,"The variable describes how satisfied the respondent is with life overall.  (In conclusion, we would like to ask you about your satisfaction with your life in general. How satisfied are you with your life, all things considered?) For 1990, 2011-2013, 2018, question not asked for all samples.",,,"Attitudes, Values, and Personality",pl,https://paneldata.org/soep-core/data/pl/plh0183,`plh0183 <https://paneldata.org/soep-core/data/pl/plh0183>`_,,
plh0184,byte,Frequency angry last 4 weeks,soep-core,p_data,v36,No,Yes,,,,"The collection of variables describes the psychological complex of topics Affective well-being  For 2010-2012, 2015-2019, question not asked for all samples.",,,Health and Care,pl,https://paneldata.org/soep-core/data/pl/plh0184,`plh0184 <https://paneldata.org/soep-core/data/pl/plh0184>`_,,
plh0185,byte,Frequency anxious last 4 weeks,soep-core,p_data,v36,No,Yes,,,,"The collection of variables describes the psychological complex of topics Affective well-being  For 2010-2012, 2015-2019, question not asked for all samples.",,,Health and Care,pl,https://paneldata.org/soep-core/data/pl/plh0185,`plh0185 <https://paneldata.org/soep-core/data/pl/plh0185>`_,,
plh0186,byte,Frequency happy last 4 weeks,soep-core,p_data,v36,No,Yes,,,,"The collection of variables describes the psychological complex of topics Affective well-being  For 2010-2012, 2015-2019, question not asked for all samples.",,,Health and Care,pl,https://paneldata.org/soep-core/data/pl/plh0186,`plh0186 <https://paneldata.org/soep-core/data/pl/plh0186>`_,,
plh0187,byte,Frequency sad last 4 weeks,soep-core,p_data,v36,No,Yes,,,,"The collection of variables describes the psychological complex of topics Affective well-being  For 2010-2012, 2015-2019, question not asked for all samples.",,,Health and Care,pl,https://paneldata.org/soep-core/data/pl/plh0187,`plh0187 <https://paneldata.org/soep-core/data/pl/plh0187>`_,,
plh0188,byte,See future confidently,soep-core,p_data,v36,No,Yes,,,,"The collection of variables describes the psychological thematic complex of anomie For 1990-1991, 2013, 2018, question not asked for all samples.",,,"Attitudes, Values, and Personality",pl,https://paneldata.org/soep-core/data/pl/plh0188,`plh0188 <https://paneldata.org/soep-core/data/pl/plh0188>`_,,
plh0189,byte,Often feel lonely,soep-core,p_data,v36,No,Yes,,,,"The collection of variables describes the psychological thematic complex of anomie For 1990-1991, 2013, 2018, question not asked for all samples.",,,Health and Care,pl,https://paneldata.org/soep-core/data/pl/plh0189,`plh0189 <https://paneldata.org/soep-core/data/pl/plh0189>`_,,
plh0190,byte,No joy at work,soep-core,p_data,v36,No,Yes,,,,"The collection of variables describes the psychological thematic complex of anomie For 1990-1991, 2013, 2018, question not asked for all samples.",,,Health and Care,pl,https://paneldata.org/soep-core/data/pl/plh0190,`plh0190 <https://paneldata.org/soep-core/data/pl/plh0190>`_,,
plh0191,byte,Conditions so complicated today,soep-core,p_data,v36,No,Yes,,,,"The collection of variables describes the psychological thematic complex of anomie For 1990-1991, 2013, 2018, question not asked for all samples.",,,"Attitudes, Values, and Personality",pl,https://paneldata.org/soep-core/data/pl/plh0191,`plh0191 <https://paneldata.org/soep-core/data/pl/plh0191>`_,,
plh0192,byte,General trust,soep-core,p_data,v36,No,Yes,,,,"This collection of variables includes several questions about trust, trustworthiness and fairness. For 2013, 2018, question not asked for all samples.",,,"Attitudes, Values, and Personality",pl,https://paneldata.org/soep-core/data/pl/plh0192,`plh0192 <https://paneldata.org/soep-core/data/pl/plh0192>`_,,
plh0193,byte,No reliance on anyone today,soep-core,p_data,v36,No,Yes,,,,"This collection of variables includes several questions about trust, trustworthiness and fairness. For 2013, 2018, question not asked for all samples.",,,"Attitudes, Values, and Personality",pl,https://paneldata.org/soep-core/data/pl/plh0193,`plh0193 <https://paneldata.org/soep-core/data/pl/plh0193>`_,,
plh0194,byte,Caution towards strangers,soep-core,p_data,v36,No,Yes,,,,"This collection of variables includes several questions about trust, trustworthiness and fairness. For 2013, 2018, question not asked for all samples.",,,"Attitudes, Values, and Personality",pl,https://paneldata.org/soep-core/data/pl/plh0194,`plh0194 <https://paneldata.org/soep-core/data/pl/plh0194>`_,,
plh0195,byte,"People take advantage, are fair",soep-core,p_data,v36,No,Yes,,,,"This collection of variables includes several questions about trust, trustworthiness and fairness. For 2013, 2018, question not asked for all samples.",,,"Attitudes, Values, and Personality",pl,https://paneldata.org/soep-core/data/pl/plh0195,`plh0195 <https://paneldata.org/soep-core/data/pl/plh0195>`_,,
plh0196,byte,"People helpful, self-interest",soep-core,p_data,v36,No,Yes,,,,"This collection of variables includes several questions about trust, trustworthiness and fairness. For 2013, 2018, question not asked for all samples.",,,"Attitudes, Values, and Personality",pl,https://paneldata.org/soep-core/data/pl/plh0196,`plh0196 <https://paneldata.org/soep-core/data/pl/plh0196>`_,,
plh0204_h,byte,Risk-taking,soep-core,p_data,v36,Yes,Yes,,,,"The variable describes the respondent's willingness to take risks. (How do you rate yourself personally? In general, are you someone who is willing to take risks or do you try to avoid risks?) For 2011, 2013, question not asked for all samples.",,,"Attitudes, Values, and Personality",pl,https://paneldata.org/soep-core/data/pl/plh0204_h,`plh0204_h <https://paneldata.org/soep-core/data/pl/plh0204_h>`_,,
plh0206i01,byte,Reciprocity: Willingness to return favors,soep-core,p_data,v36,Yes,Yes,,,,"The collection of variables describes the psychological topic Reciprocity. For 2010, 2016-2019, question not asked for all samples.",,,"Attitudes, Values, and Personality",pl,https://paneldata.org/soep-core/data/pl/plh0206i01,`plh0206i01 <https://paneldata.org/soep-core/data/pl/plh0206i01>`_,,
plh0206i02,byte,Reciprocity: Revenge in case of grave injustice,soep-core,p_data,v36,Yes,Yes,,,,"The collection of variables describes the psychological topic Reciprocity. For 2010, 2016-2019, question not asked for all samples.",,,"Attitudes, Values, and Personality",pl,https://paneldata.org/soep-core/data/pl/plh0206i02,`plh0206i02 <https://paneldata.org/soep-core/data/pl/plh0206i02>`_,,
plh0206i03,byte,Reciprocity: Paying back: putting someone in a difficult position,soep-core,p_data,v36,Yes,Yes,,,,"The collection of variables describes the psychological topic Reciprocity. For 2010, 2016-2019, question not asked for all samples.",,,"Attitudes, Values, and Personality",pl,https://paneldata.org/soep-core/data/pl/plh0206i03,`plh0206i03 <https://paneldata.org/soep-core/data/pl/plh0206i03>`_,,
plh0206i04,byte,Reciprocity: Special effort to return help,soep-core,p_data,v36,Yes,Yes,,,,"The collection of variables describes the psychological topic Reciprocity. For 2010, 2016-2019, question not asked for all samples.",,,"Attitudes, Values, and Personality",pl,https://paneldata.org/soep-core/data/pl/plh0206i04,`plh0206i04 <https://paneldata.org/soep-core/data/pl/plh0206i04>`_,,
plh0206i05,byte,Reciprocity: Offensive behavior in case of insults,soep-core,p_data,v36,Yes,Yes,,,,"The collection of variables describes the psychological topic Reciprocity. For 2010, 2016-2019, question not asked for all samples.",,,"Attitudes, Values, and Personality",pl,https://paneldata.org/soep-core/data/pl/plh0206i05,`plh0206i05 <https://paneldata.org/soep-core/data/pl/plh0206i05>`_,,
plh0206i06,byte,Reciprocity: Willingness to incur costs to return help,soep-core,p_data,v36,Yes,Yes,,,,"The collection of variables describes the psychological topic Reciprocity. For 2010, 2016-2019, question not asked for all samples.",,,"Attitudes, Values, and Personality",pl,https://paneldata.org/soep-core/data/pl/plh0206i06,`plh0206i06 <https://paneldata.org/soep-core/data/pl/plh0206i06>`_,,
plh0212,byte,Big Five Traits (Conscientiousness): Work diligently,soep-core,p_data,v36,Yes,Yes,,,,"The Big Five personality traits is a suggested taxonomy, or grouping, for personality traits, developed from the 1980s onward in psychological trait theory. This variable is one item to descirbe a big five dimension. For 2012-2013, 2017, 2019, question not asked for all samples.",,,"Attitudes, Values, and Personality",pl,https://paneldata.org/soep-core/data/pl/plh0212,`plh0212 <https://paneldata.org/soep-core/data/pl/plh0212>`_,,
plh0213,byte,Big Five Traits (Extraversion): I am communicative,soep-core,p_data,v36,Yes,Yes,,,,"The Big Five personality traits is a suggested taxonomy, or grouping, for personality traits, developed from the 1980s onward in psychological trait theory. This variable is one item to descirbe a big five dimension. For 2012-2013, 2017, 2019, question not asked for all samples.",,,"Attitudes, Values, and Personality",pl,https://paneldata.org/soep-core/data/pl/plh0213,`plh0213 <https://paneldata.org/soep-core/data/pl/plh0213>`_,,
plh0214,byte,Big Five Traits (Agreeableness): I am sometimes too rough with others,soep-core,p_data,v36,Yes,Yes,,,,"The Big Five personality traits is a suggested taxonomy, or grouping, for personality traits, developed from the 1980s onward in psychological trait theory. This variable is one item to descirbe a big five dimension. For 2012-2013, 2017, 2019, question not asked for all samples.",,,"Attitudes, Values, and Personality",pl,https://paneldata.org/soep-core/data/pl/plh0214,`plh0214 <https://paneldata.org/soep-core/data/pl/plh0214>`_,,
plh0215,byte,Big Five Traits (Openness): I am original,soep-core,p_data,v36,Yes,Yes,,,,"The Big Five personality traits is a suggested taxonomy, or grouping, for personality traits, developed from the 1980s onward in psychological trait theory. This variable is one item to descirbe a big five dimension. For 2012-2013, 2017, 2019, question not asked for all samples.",,,"Attitudes, Values, and Personality",pl,https://paneldata.org/soep-core/data/pl/plh0215,`plh0215 <https://paneldata.org/soep-core/data/pl/plh0215>`_,,
