variable,type,label_de,study,dataset,version,meantable,probtable,template_id,label,concept,description,description_de,minedition,topic,rawdata,documentation_link,documentation_link_html,documentation_paper,documentation_paper_html
pgfamstd,byte,Marital Status in Survey Year,soep-core,p_data,v36,No,Yes,,,,"Marital status is describing the institutional status of marriage at the time of the person interview. Marital status is based on information given by the respective person on his or her current relationship as well as on retrospective information about previous relationships asked in the biography questionnaire. Information on marital status when a child was born (provided in the biography information) is not used here, so contradicting information to file BIOBIRTH might still be possible. For those whose partner was identified within the household, marital status is counter-checked with the information given by the partner. Where contradictions can be found, indication of the person information is compiled if reasonable. If no information is available, the indication by position related to head of household is deferred. Remaining contradictions are solved using information on marriage status when a child was born as well as future reports on a given relationship. Marital status is only available for people, who were interviewed. Data on marital status provided here is generated from and hence consistent with the corresponding BIOMARSY file, although value labels differ between PGFAMSTD and SPELLTYP in BIOMARSY. Note that marital status in a specific wave can be different between data distributions due to consistency checks using up-to-date information from following waves. Because of the newly introduced construction process of BIOMARSY, changes might be more than usual. Above, the partner indicator PGPARTZ supplied here in dataset PGEN as well might not match the information provided in PGFAMSTD in its entirety.",,,"Home, Amenities, and Contributions of Private HH",pgen,https://paneldata.org/soep-core/data/pgen/pgfamstd,`pgfamstd <https://paneldata.org/soep-core/data/pgen/pgfamstd>`_,https://www.diw.de/documents/publikationen/73/diw_01.c.830975.de/diw_ssp1047.pdf,`pgen Codebook Surveypaper <https://www.diw.de/documents/publikationen/73/diw_01.c.830975.de/diw_ssp1047.pdf>`_
pgisced97,double,ISCED-1997-Classification,soep-core,p_data,v36,demo,demo,,,,,,,Demography,pgen,https://paneldata.org/soep-core/data/pgen/pgisced97,`pgisced97 <https://paneldata.org/soep-core/data/pgen/pgisced97>`_,https://www.diw.de/documents/publikationen/73/diw_01.c.830975.de/diw_ssp1047.pdf,`pgen Codebook Surveypaper <https://www.diw.de/documents/publikationen/73/diw_01.c.830975.de/diw_ssp1047.pdf>`_
pglabgro,double,Current Gross Labor Income in Euro,soep-core,p_data,v36,Yes,No,,,,"The variable PGLABGRO represents the imputed gross labor income in the previous month generated for all SOEP respondents who are employed in a main job in each respective wave. Interviewees should consider overtime payments but no irregular one-time payments such as holiday or bonuses. Income details are consistently provided in euros for all waves. Item nonresponse is imputed in a two-stage procedure: first, with the ""Row-and-Column""ù method of Little und Su (1989) using individual longitudinal data as well as cross-sectional trend data (cf. Joachim R. Frick and Markus M. Grabka (2005): Item-Non-Response on Income Questions in Panel surveys: Incidence, Imputation and the Impact on the Income Distribution. Allgemeines Statistisches Archiv (ASTA) 89, 49-61). Alternatively, if no individual longitudinal information is available, we base the imputation on a regression using different Mincer covariates, also taking into account current net labor income. If both types of income information are lacking, first we impute current net labor income and then current gross labor income. Imputed values are flagged (PGIMPGRO). For 2006-2019, question not asked of all samples.",,,"Income, Taxes, and Social Security",pgen,https://paneldata.org/soep-core/data/pgen/pglabgro,`pglabgro <https://paneldata.org/soep-core/data/pgen/pglabgro>`_,https://www.diw.de/documents/publikationen/73/diw_01.c.830975.de/diw_ssp1047.pdf,`pgen Codebook Surveypaper <https://www.diw.de/documents/publikationen/73/diw_01.c.830975.de/diw_ssp1047.pdf>`_
pglabnet,double,Current Net Labor Income in Euro,soep-core,p_data,v36,Yes,No,,,,"The variable PGLABNET represents the imputed net labor income in the previous month in a main job of all persons in SOEP working in the respective wave. Interviewees should consider overtime payments but no irregular one-time payments such as holiday or bonuses. Income details are consistently provided in euros for all waves. The imputation of item nonresponse takes place in a two-stage procedure: first, with the ""Row-and- Column"" method of Little und Su (1989) using individual longitudinal data as well as cross-sectional trend data (cf. Joachim R. Frick and Markus M. Grabka (2005): Item-Non-Response on Income Questions in Panel surveys: Incidence, Imputation and the Impact on the Income Distribution. Allgemeines Statistisches Archiv (ASTA) 89, 49-61). Alternatively, if no individual longitudinal information is available, we base the imputation on a regression using different Mincer covariates, also taking into account current gross labor income. If both types of income information are lacking, first we impute current gross labor income and then current net labor income. For 2006-2019, question not asked of all samples.",,,"Income, Taxes, and Social Security",pgen,https://paneldata.org/soep-core/data/pgen/pglabnet,`pglabnet <https://paneldata.org/soep-core/data/pgen/pglabnet>`_,https://www.diw.de/documents/publikationen/73/diw_01.c.830975.de/diw_ssp1047.pdf,`pgen Codebook Surveypaper <https://www.diw.de/documents/publikationen/73/diw_01.c.830975.de/diw_ssp1047.pdf>`_
pgnation,int,Nationality,soep-core,p_data,v36,,,,,,,,,Demography,pgen,https://paneldata.org/soep-core/data/pgen/pgnation,`pgnation <https://paneldata.org/soep-core/data/pgen/pgnation>`_,https://www.diw.de/documents/publikationen/73/diw_01.c.830975.de/diw_ssp1047.pdf,`pgen Codebook Surveypaper <https://www.diw.de/documents/publikationen/73/diw_01.c.830975.de/diw_ssp1047.pdf>`_
pgoeffd,float,Civil Service,soep-core,p_data,v36,No,Yes,,,,This variable is designed to provide annual data on employment in the civil service for all employed persons.,,,Work and Employment,pgen,https://paneldata.org/soep-core/data/pgen/pgoeffd,`pgoeffd <https://paneldata.org/soep-core/data/pgen/pgoeffd>`_,https://www.diw.de/documents/publikationen/73/diw_01.c.830975.de/diw_ssp1047.pdf,`pgen Codebook Surveypaper <https://www.diw.de/documents/publikationen/73/diw_01.c.830975.de/diw_ssp1047.pdf>`_
pgtatzeit,float,Actual Work Time Per Week,soep-core,p_data,v36,Yes,No,,,,"This variable provides data on actual weekly working hours (including overtime) for all persons employed at the time of the survey (including the self-employed). The data are obtained by asking respondents how many hours they work on average per week. For implausible answers (actual weekly working hours of more than 80 per week), we assign the value (-3). The variable is rounded off and gives the number of working hours as a decimal number.",,,Work and Employment,pgen,https://paneldata.org/soep-core/data/pgen/pgtatzeit,`pgtatzeit <https://paneldata.org/soep-core/data/pgen/pgtatzeit>`_,https://www.diw.de/documents/publikationen/73/diw_01.c.830975.de/diw_ssp1047.pdf,`pgen Codebook Surveypaper <https://www.diw.de/documents/publikationen/73/diw_01.c.830975.de/diw_ssp1047.pdf>`_
pgvebzeit,float,Agreed Upon Work Time Per Week,soep-core,p_data,v36,Yes,No,,,,"This variable provides data on agreed weekly working hours. The variable takes into account only those persons who were in dependent employment (not self-employed) at the time of the survey.  The value (-2) is assigned to non-employed people, employees without set hours and to self-employed people, including self-employed farmers, freelancers, and other self-employed persons. If persons helping out in family businesses report agreed weekly working hours, we assign a non-missing value. For implausible answers (agreed weekly working time of more than 80 hours per week) we assign the value (-3). The variable is rounded off and gives the number of working hours as a decimal number.",,,Work and Employment,pgen,https://paneldata.org/soep-core/data/pgen/pgvebzeit,`pgvebzeit <https://paneldata.org/soep-core/data/pgen/pgvebzeit>`_,https://www.diw.de/documents/publikationen/73/diw_01.c.830975.de/diw_ssp1047.pdf,`pgen Codebook Surveypaper <https://www.diw.de/documents/publikationen/73/diw_01.c.830975.de/diw_ssp1047.pdf>`_
phrf,double,Weighting factor,soep-core,p_data,v36,,,,,,,,,,ppathl,https://paneldata.org/soep-core/data/ppathl/phrf,`phrf <https://paneldata.org/soep-core/data/ppathl/phrf>`_,https://www.diw.de/documents/publikationen/73/diw_01.c.830977.de/diw_ssp1048.pdf,`ppathl Codebook Surveypaper <https://www.diw.de/documents/publikationen/73/diw_01.c.830977.de/diw_ssp1048.pdf>`_
pid,long,Individual ID,soep-core,p_data,v36,,,,,,,,,,ppathl,https://paneldata.org/soep-core/data/ppathl/pid,`pid <https://paneldata.org/soep-core/data/ppathl/pid>`_,https://www.diw.de/documents/publikationen/73/diw_01.c.830977.de/diw_ssp1048.pdf,`ppathl Codebook Surveypaper <https://www.diw.de/documents/publikationen/73/diw_01.c.830977.de/diw_ssp1048.pdf>`_
plb0037_h,byte,Employment relationship Limited/Unlimited,soep-core,p_data,v36,No,Yes,,,,"The variable describes the respondent's employment contract (Do you have a fixed-term or permanent employment contract?) For 2011, 2012, questionnaire version with changed filter management. For 1990, question not asked for all samples.",,,Work and Employment,pl,https://paneldata.org/soep-core/data/pl/plb0037_h,`plb0037_h <https://paneldata.org/soep-core/data/pl/plb0037_h>`_,,
plb0050,byte,"Works council, staff council in company (""Betriebsrat"")",soep-core,p_data,v36,No,Yes,,,,"The variable describes whether there is a works council in the respondent's company. Does an employee's council exist at your place of work? For 2011, questionnaire version with changed filter management. For 2011, 2016, 2019, question not asked for all samples.",,,Work and Employment,pl,https://paneldata.org/soep-core/data/pl/plb0050,`plb0050 <https://paneldata.org/soep-core/data/pl/plb0050>`_,,
plb0158,float,Distance from home to work in km,soep-core,p_data,v36,Yes,No,,,,The variable describes distance to place of work in km. (How far do you travel to work on a normal workday?),,,Work and Employment,pl,https://paneldata.org/soep-core/data/pl/plb0158,`plb0158 <https://paneldata.org/soep-core/data/pl/plb0158>`_,,
plb0195_h,byte,Compensate overtime,soep-core,p_data,v36,No,Yes,,,,"The variable describes how overtime is handled in the respondent's company (If you do work overtime, is the work paid, compensated with time off, or not compensated at all?). For 1990, question not asked for all samples.",,,Work and Employment,pl,https://paneldata.org/soep-core/data/pl/plb0195_h,`plb0195_h <https://paneldata.org/soep-core/data/pl/plb0195_h>`_,,
plb0196_h,byte,Overtime last month,soep-core,p_data,v36,No,Yes,,,,"The variable describes respondet has worked overtime in the last month (Have you worked overtime in the last month? If so, how many hours?). . For 1990, 2016-2019, question not asked for all samples.",,,Work and Employment,pl,https://paneldata.org/soep-core/data/pl/plb0196_h,`plb0196_h <https://paneldata.org/soep-core/data/pl/plb0196_h>`_,,
plb0197,float,Overtime last month number,soep-core,p_data,v36,Yes,No,,,,"The variable describes the number of overtime hours worked (Have you worked overtime in the last month? If so, how many hours?). For 2016-2019, question not asked for all samples.",,,Work and Employment,pl,https://paneldata.org/soep-core/data/pl/plb0197,`plb0197 <https://paneldata.org/soep-core/data/pl/plb0197>`_,,
plb0218,byte,Work on Saturday,soep-core,p_data,v36,No,Yes,,,,"The variable describes how often the respondent has to work on Sunday. (Do you have to work weekends? If so, how often?). For 2010, 2012, 2013, 2015, 2017, 2019, question not asked for all samples.",,,Work and Employment,pl,https://paneldata.org/soep-core/data/pl/plb0218,`plb0218 <https://paneldata.org/soep-core/data/pl/plb0218>`_,,
plb0219,byte,Work on Sunday,soep-core,p_data,v36,No,Yes,,,,"The variable describes how often the respondent has to work on Sunday. (Do you have to work weekends? If so, how often?) For 2010, 2012, 2013, 2015, 2017, 2019, question not asked for all samples.",,,Work and Employment,pl,https://paneldata.org/soep-core/data/pl/plb0219,`plb0219 <https://paneldata.org/soep-core/data/pl/plb0219>`_,,
pld0043,byte,Hfk. pers. Lend things to friends,soep-core,p_data,v36,No,Yes,,,,"This collection of variables includes several questions about trust, trustworthiness and fairness. For 2013, 2018, questionnaire version with changed filter management. For 1990, question not asked for all samples.",,,"Attitudes, Values, and Personality",pl,https://paneldata.org/soep-core/data/pl/pld0043,`pld0043 <https://paneldata.org/soep-core/data/pl/pld0043>`_,,
pld0044,byte,Hfk. Lend money to friends,soep-core,p_data,v36,No,Yes,,,,"This collection of variables includes several questions about trust, trustworthiness and fairness. For 2013, 2018, questionnaire version with changed filter management. For 1990, question not asked for all samples.",,,"Attitudes, Values, and Personality",pl,https://paneldata.org/soep-core/data/pl/pld0044,`pld0044 <https://paneldata.org/soep-core/data/pl/pld0044>`_,,
pld0045,byte,Hfk. Door unlocked,soep-core,p_data,v36,No,Yes,,,,"This collection of variables includes several questions about trust, trustworthiness and fairness. For 2013, 2018, questionnaire version with changed filter management. For 1990, question not asked for all samples.",,,"Attitudes, Values, and Personality",pl,https://paneldata.org/soep-core/data/pl/pld0045,`pld0045 <https://paneldata.org/soep-core/data/pl/pld0045>`_,,
pld0047,float,Number of close friends,soep-core,p_data,v36,Yes,No,,,,The variable includes the number of close friends of the respondent. (What would you say: How many close do you have and how many of them are colleagues?),Die Variable umfasst die Anza,,Time Use and Environmental Behavior,pl,https://paneldata.org/soep-core/data/pl/pld0047,`pld0047 <https://paneldata.org/soep-core/data/pl/pld0047>`_,,
ple0004,byte,Health condition impaired Climbing stairs,soep-core,p_data,v36,No,Yes,,,,"Variable describes the evaluation of the own health. (If you have to climb stairs, i.e. walk up several floors: Does your state of health restrict you a lot, a little or not at all?) For 2010, 2012, 2016-2019, question not asked for all samples.",,,Health and Care,pl,https://paneldata.org/soep-core/data/pl/ple0004,`ple0004 <https://paneldata.org/soep-core/data/pl/ple0004>`_,,
ple0005,byte,Health condition impair. exert. Activities,soep-core,p_data,v36,No,Yes,,,,"Variable describes the evaluation of the own health. (And what about other strenuous activities in everyday life, e.g. when you have to lift something heavy or need to be mobile: Does your state of health restrict you a lot, a little or not at all?) For 2010, 2012, 2016-2019, question not asked for all samples.",,,Health and Care,pl,https://paneldata.org/soep-core/data/pl/ple0005,`ple0005 <https://paneldata.org/soep-core/data/pl/ple0005>`_,,
ple0006,float,Body height in cm,soep-core,p_data,v36,Yes,No,,,,"The variable describes the height of the respondent in cm. For 2010, 2012, 2016, 2018, question not asked for all samples.",,,Health and Care,pl,https://paneldata.org/soep-core/data/pl/ple0006,`ple0006 <https://paneldata.org/soep-core/data/pl/ple0006>`_,,
ple0007,float,Body weight in kg,soep-core,p_data,v36,Yes,No,,,,"The variable describes body weight of the respondent in kg.For 2010, 2012, 2016, 2018, question not asked for all samples.",,,Health and Care,pl,https://paneldata.org/soep-core/data/pl/ple0007,`ple0007 <https://paneldata.org/soep-core/data/pl/ple0007>`_,,
ple0008,byte,Current state of health,soep-core,p_data,v36,No,Yes,,,,Variable describes the evaluation of the own health. (How would you describe your current health?),,,Health and Care,pl,https://paneldata.org/soep-core/data/pl/ple0008,`ple0008 <https://paneldata.org/soep-core/data/pl/ple0008>`_,,
ple0009,byte,Restriction in everyday life due to health problems,soep-core,p_data,v36,No,Yes,,,,"The variable describes whether the respondent's health influences daily life. (Are you restricted in normal everyday activities by a health problem ?) (For 2011, 2016-2018, question not asked for all samples.",,,Health and Care,pl,https://paneldata.org/soep-core/data/pl/ple0009,`ple0009 <https://paneldata.org/soep-core/data/pl/ple0009>`_,,
ple0011,byte,Sleep disorder,soep-core,p_data,v36,No,Yes,,,,The variable describes whether the respondent suffers from a disease. (Has a doctor ever diagnosed you to have one or more of the following illnesses?) Question not asked for all samples.,,,Health and Care,pl,https://paneldata.org/soep-core/data/pl/ple0011,`ple0011 <https://paneldata.org/soep-core/data/pl/ple0011>`_,,
ple0012,byte,diabetes,soep-core,p_data,v36,No,Yes,,,,The variable describes whether the respondent suffers from a disease. (Has a doctor ever diagnosed you to have one or more of the following illnesses?) Question not asked for all samples.,,,Health and Care,pl,https://paneldata.org/soep-core/data/pl/ple0012,`ple0012 <https://paneldata.org/soep-core/data/pl/ple0012>`_,,
ple0013,byte,asthma,soep-core,p_data,v36,No,Yes,,,,The variable describes whether the respondent suffers from a disease. (Has a doctor ever diagnosed you to have one or more of the following illnesses?) Question not asked for all samples.,,,Health and Care,pl,https://paneldata.org/soep-core/data/pl/ple0013,`ple0013 <https://paneldata.org/soep-core/data/pl/ple0013>`_,,
ple0014,byte,Heart disease,soep-core,p_data,v36,No,Yes,,,,The variable describes whether the respondent suffers from a disease. (Has a doctor ever diagnosed you to have one or more of the following illnesses?) Question not asked for all samples.,,,Health and Care,pl,https://paneldata.org/soep-core/data/pl/ple0014,`ple0014 <https://paneldata.org/soep-core/data/pl/ple0014>`_,,
ple0015,byte,Cancer,soep-core,p_data,v36,No,Yes,,,,The variable describes whether the respondent suffers from a disease. (Has a doctor ever diagnosed you to have one or more of the following illnesses?) Question not asked for all samples.,,,Health and Care,pl,https://paneldata.org/soep-core/data/pl/ple0015,`ple0015 <https://paneldata.org/soep-core/data/pl/ple0015>`_,,
ple0016,byte,Stroke,soep-core,p_data,v36,No,Yes,,,,The variable describes whether the respondent suffers from a disease. (Has a doctor ever diagnosed you to have one or more of the following illnesses?) Question not asked for all samples.,,,Health and Care,pl,https://paneldata.org/soep-core/data/pl/ple0016,`ple0016 <https://paneldata.org/soep-core/data/pl/ple0016>`_,,
ple0017,byte,Migraine,soep-core,p_data,v36,No,Yes,,,,The variable describes whether the respondent suffers from a disease. (Has a doctor ever diagnosed you to have one or more of the following illnesses?) Question not asked for all samples.,,,Health and Care,pl,https://paneldata.org/soep-core/data/pl/ple0017,`ple0017 <https://paneldata.org/soep-core/data/pl/ple0017>`_,,
ple0018,byte,High blood pressure,soep-core,p_data,v36,No,Yes,,,,The variable describes whether the respondent suffers from a disease. (Has a doctor ever diagnosed you to have one or more of the following illnesses?) Question not asked for all samples.,,,Health and Care,pl,https://paneldata.org/soep-core/data/pl/ple0018,`ple0018 <https://paneldata.org/soep-core/data/pl/ple0018>`_,,
ple0019,byte,Depressive illness,soep-core,p_data,v36,No,Yes,,,,The variable describes whether the respondent suffers from a disease. (Has a doctor ever diagnosed you to have one or more of the following illnesses?) Question not asked for all samples.,,,Health and Care,pl,https://paneldata.org/soep-core/data/pl/ple0019,`ple0019 <https://paneldata.org/soep-core/data/pl/ple0019>`_,,
ple0020,byte,Dementia,soep-core,p_data,v36,No,Yes,,,,The variable describes whether the respondent suffers from a disease. (Has a doctor ever diagnosed you to have one or more of the following illnesses?) Question not asked for all samples.,,,Health and Care,pl,https://paneldata.org/soep-core/data/pl/ple0020,`ple0020 <https://paneldata.org/soep-core/data/pl/ple0020>`_,,
ple0021,byte,"Joint diseases (also arthrosis, rheumatism)",soep-core,p_data,v36,No,Yes,,,,The variable describes whether the respondent suffers from a disease. (Has a doctor ever diagnosed you to have one or more of the following illnesses?) Question not asked for all samples.,,,Health and Care,pl,https://paneldata.org/soep-core/data/pl/ple0021,`ple0021 <https://paneldata.org/soep-core/data/pl/ple0021>`_,,
ple0022,byte,Chronic back problems,soep-core,p_data,v36,No,Yes,,,,The variable describes whether the respondent suffers from a disease. (Has a doctor ever diagnosed you to have one or more of the following illnesses?) Question not asked for all samples.,,,Health and Care,pl,https://paneldata.org/soep-core/data/pl/ple0022,`ple0022 <https://paneldata.org/soep-core/data/pl/ple0022>`_,,
ple0024,byte,No disease detected,soep-core,p_data,v36,No,Yes,,,,The variable describes whether the respondent suffers from a disease. (Has a doctor ever diagnosed you to have one or more of the following illnesses?) Question not asked for all samples.,,,Health and Care,pl,https://paneldata.org/soep-core/data/pl/ple0024,`ple0024 <https://paneldata.org/soep-core/data/pl/ple0024>`_,,
ple0040,byte,"Disability, severe disability",soep-core,p_data,v36,No,Yes,,,,"Variable describes whether the respondent has been diagnosed with a severe disability. (Have you been officially assessed as being severely disabled (Schwerbehindert) or partially incapable of work (Erwerbsgemindert) for medical reasons?) For 2016-2019, question not asked for all samples",,,Health and Care,pl,https://paneldata.org/soep-core/data/pl/ple0040,`ple0040 <https://paneldata.org/soep-core/data/pl/ple0040>`_,,
ple0041,byte,Degree of disability in percent,soep-core,p_data,v36,Yes,No,,,,"Variable describes the degree to which the severe disability was determined. (What is the degree of your reduced capability to work (Erwerbsminderung) or disabilty (Schwerbehinderung)?). (For 2016-2019, question not asked for all samples",,,Health and Care,pl,https://paneldata.org/soep-core/data/pl/ple0041,`ple0041 <https://paneldata.org/soep-core/data/pl/ple0041>`_,,
ple0044_h,byte,Didn't Work Last Year Due to Illness,soep-core,p_data,v36,No,Yes,,,,"Variable describes how many days the respondent could not work in the last year. (How many days were you unable to work in last year due to illness?). For 2011, 2016-2019, question not asked for all samples",,,Health and Care,pl,https://paneldata.org/soep-core/data/pl/ple0044_h,`ple0044_h <https://paneldata.org/soep-core/data/pl/ple0044_h>`_,,
ple0053,byte,Hospitalization previous year,soep-core,p_data,v36,No,Yes,,,,"Variable describes had spend a night in a hospital in the last year. (What about hospital stays in the last year - were you admitted to a hospital for at least one night in the last year?). For 2013, 2015-2019, question not asked for all samples",,,Health and Care,pl,https://paneldata.org/soep-core/data/pl/ple0053,`ple0053 <https://paneldata.org/soep-core/data/pl/ple0053>`_,,
ple0055,float,Hospitalization previous year Number,soep-core,p_data,v36,Yes,No,,,,"Variable describes how many days the respondent had to spend in a hospital in the last year. (How many nights total did you spend in the hospital last year?) For 2013, 2015-2019, question not asked for all samples",,,Health and Care,pl,https://paneldata.org/soep-core/data/pl/ple0055,`ple0055 <https://paneldata.org/soep-core/data/pl/ple0055>`_,,
ple0056,float,Hospitalization previous year Nights,soep-core,p_data,v36,Yes,No,,,,"Variable describes how many nights the respondent had to spend in a hospital in the last year. (How many nights total did you spend in the hospital last year?) For 2013, 2015-2019, question not asked for all samples",,,Health and Care,pl,https://paneldata.org/soep-core/data/pl/ple0056,`ple0056 <https://paneldata.org/soep-core/data/pl/ple0056>`_,,
ple0081_h,float,Smoking,soep-core,p_data,v36,No,Yes,,,,"The variable describes whether the respondent currently smokes. (Do you currently smoke, whether cigarettes, a pipe, or cigars?) For 2010, 2012, 2016, 2018, question not asked for all samples.",,,Health and Care,pl,https://paneldata.org/soep-core/data/pl/ple0081_h,`ple0081_h <https://paneldata.org/soep-core/data/pl/ple0081_h>`_,,
ple0097,byte,Type of health insurance,soep-core,p_data,v36,No,Yes,,,,"The variable describes the type of health insurance. (What kind of health insurance do you have: statutory health insurance or are you exclusively privately insured?). For 2016-2019, question not asked for all samples",,,Health and Care,pl,https://paneldata.org/soep-core/data/pl/ple0097,`ple0097 <https://paneldata.org/soep-core/data/pl/ple0097>`_,,
ple0098_v5,byte,Private supplementary health insurance (yes/no),soep-core,p_data,v36,No,Yes,,,,"The variable describes whether the respondent has private health insurance. (Do you have supplementary private health insurance?) For 2011, 2013, 2016, 2018, question not asked for all samples.",,,Health and Care,pl,https://paneldata.org/soep-core/data/pl/ple0098_v5,`ple0098_v5 <https://paneldata.org/soep-core/data/pl/ple0098_v5>`_,,
